,userName,score,clean_review,label
395,Diah Palupi,5,sebuah start up quick commerce yang memberikan layanan belanja cepat untuk beberapa kawasan pilihan produk banyak dan lengkap banget harga produknya lumayan kompetitif pelayanannya cepat proses pengiriman dan pembayaran juga cepat dan bagus semoga kedepannya sistem astro semakin baik,1
396,Kuzbass Pertiwi,5,ga perlu worry dan ga perlu repot lagi saat pengen beli makan dan minum khususnya aku yang jarang keluar rumah waktu belanja di luar bisa dipake untuk hal lain benar mempermudah pembelanjaan makanan dan minuman thanks,1
397,Fatkhul Huda,5,cukup memuaskan astro ini kaget bgt di dalamnya kebutuhan bayi ada juga dan varian produk kebutuhan bayinya lengkap driver nya baik murah senyum dan sopan sangat mempermudah saya untuk belanja kebutuhan sehari,1
398,Haikal,5,prtama kali pake apk ini puas rasanya pilihan belanjaannya banyak jadi puas pilih pilihnya harganya pun cukup relatif proses dan pengirimannya juga cepat makasih,1
399,akhmad zaenal,5,repot sih kalo belanja harus keluar dan tutup toko dulu pake astro jadi lebih mudah pilihan barang lengkap proses dari pelayan sampai pengiriman juga cepat terimakasih banyak astro,1
400,Dea Safryda,5,alhamdulillah amanah membantu banget kalo mau belanja kebutuhan makanan dan minuman sehari hari apalagi kondisi rawan virus kayak sekarang mau keluar belanja juga agak ngeri untung banget ada astro ini yang sangat membantu dan pengirimannya juga cepat mantaplah semoga semakin berkembang,1
401,Septa Yulanda,5,aplikasinya bagus banget apalagi barang yg di pesan langsung datang dalam waktu menit jadi ga nunggu lama deh kalo mau beli barang yg dibutuhkannya cepat bisa pake astro aja packagingnya jg bagus,1
402,Ersa Indriani,5,aplikasi ini berguna banget buat yang mager ataupun karyawan yang tiap hari kerja dan ga sempat belanja ke pasar ataupun ke supermarket pilihan produknya lengkap mulai dari kebutuhan pokok seperti makanan sayuran minuman kalo mau beli keperluan bayi sama anak dan skincare bodycare pun bisa lewat astro pengirimannya juga cepat satsetsatset nyampe rumah,1
403,shofiatul,5,harga produk lumayan kompetitif yaa suka banget pake astro ini juga proses pembayaran mudah dan ga ribet recommend sekalii untuk kalian yg mau belanja makanan dan minuman yg gamau ribet hihi,1
404,Arifin Ilham,5,belanja jauh lebih praktis ga perlu cape ke minimarket cukup dengan pesen lewat hp semua keperluan dan kelengkapan keperluan makanan dan minuman lengkap banget proses pengiriman super cepat juga,1
405,GAMERS YANUAR BACOT,5,keren sih astro pengiriman belanjaan super cepat banget cuma menit aja asiknya lagi nih yang membuat saya suka harga di astro lumayan kompetitif dan murah juga ya mantap sih menurut aku,1
406,ERROR QUIKCS,5,semenjak pandemi males banget keluar rumah akhirnya ada aplikasi astro saya yang notabene nya ibu rumah tangga jadi gampang banget mau belanja kebutuhan rumah pengiriman belanjaan nya hanya menit the best buat aplikasi nya,1
407,Beauty Nature,5,suka belanja disini sekarang pengirimannya itu yg cepet cuman menit udah nyampe metode bayar nya juga mudah bisa pakai e wallet bakal langganan terus buat belanja di astro,1
408,maisya saroh,5,pakai astro semudah itu pengiriman super cepat cuma menit aja pilihan produknya lengkap banget barang diterima dengan lengkap tanpa ada kurang sedikitpun proses pembayarannya pun mudah,1
409,Yuli Indarti,1,awal ny belanja disini bagus dapet point sampe ngasih tau tmn buat download aplikasi ini tp ternyta lama point hilang di bilang menyalahgunakan akun baru daftar point langsung hilang aplikasi ini sangat mengecewakan promo ny juga lama hilang,0
410,Chika Thv,5,aku pengguna baru astro bagus banget ni barang nya hampir lengkap kurirnya ramah penngemasan dan pengiriman cepet bgt ga sampe menit setelah payment udah sampe barangnya dan selalu lengkap ga pernah kurang,1
411,Zuraga Funzizar,5,aplikasi belanja yang pengiriman nya cepat pilihan produk banyak lengkap harganya bersahabat kondisi barangnya juga aman recommended buat yg suka belanja dan pengen barangnya datang cepat dan aman,1
412,Viviane Putri,5,pengalamanku selama pakai aplikasi ini bisa dibilang menyenangkan produk yg disediakan lengkap banget yang paling ku suka itu proses pengirimannya cepat ditambah kondisi barang baik semua makin suka pakai aplikasi ini,1
413,Christ Anderson,5,puas belanja di astro soalnya pengirimannya cuma menit aja loh awalnya agak skeptis tapi kaget beneran nyampe dalam waktu ga nyampe menit lagi beruntung aja deh kayaknya aku wkwkwk,1
414,Siti Halimah,5,guys kalian wajib banget pake aplikasi ini selain terbaik untuk belanja di masa pandemi ini jadi bisa belanja kebutuhan online kalian juga perlu khawatir karena kondisi barang baik semua selain itu proses pengiriman cepat terimakasih astro,1
415,Jovita Agusti Cahyaningtyas,5,aplikasi ini bagus dan membantu banget buat belanja berbagai kebutuhan makanan dan minuman sehari hari pengirimannya super cepat hanya menitan selain itu produknya juga lengkap dan harganya cukup terjangkau astro emang recommended deh,1
416,Cahya,5,berawal iseng karena posisi lg riweuh banget dan ga sempet belanja bulanan ehh sekarang jadi ketagihan belanja pake astro pilihan produk banyak dan lengkap banget dari mulai buah sayur mayur sembako obat bahkan sampe perlengkapan kebersihan juga ada mana proses pengiriman cepat banget lagii lovee banget pokoknya,1
417,Izza Kyra,5,mempermudah saya dalam belanja kebutuhan makanan dan minuman pilihan produknya banyak dan lengkap tinggal lihat katalognya aja pengiriman juga cepat banget ya mantap,1
418,Erwinda Mustikaning Tyas,5,seneng banget belanja lewat astro disini kategori kebutuhan belanja sangat lengkap jadi gak pusing cari kebutuhan belanjaan yg mencar tinggal masukin keranjang terus dikirim sat set ga pake lama cocok buat yg susah keluar karna sibuk ngurus rumah sm anak jadi ga repot bagi waktu buat keluar rumah,1
419,Adel Tin,5,app bagus yang support buat aku yang mageran pilihan produk banyak dan lengkap banget pelayanan cepat sat set sat set dikirim fitur nya juga mudah dipahami dan bisa ngumpulin koin juga,1
420,Stephen Leo,5,suka banget sama aplikasi ini selain proses pembayaran mudah yang bikin makin senang proses pengiriman cepat yang tentunya ngebantu banget buat yang mager kluar tpi lagi banyak kebutuhan d,1
421,Tety Fdalh,5,benaran keren nih astro bayangkan pengiriman belanjaan cuma menit aja belanjaan gue dah sampai padahal lagi macet parah jalanan hebatnya lagi meski hujan kondisi barang di terima dalam keadaan baik mantap nih astro,1
422,Arfa Arfa,5,wahh kmren baru nyoba beli bahan makanan buat seminggu ternyata worth it bakal jadi ide buat malam tahun baru nih min gaperlu keluar rumah tinggal pesan aja di astro soalnya pengiriman barang pesanan saya cepat hanya menit sudah sampai keren lah,1
423,Raknum Izo,5,seneng banget sama aplikasi ini mulai dari pengiriman barang yg cepet gak perlu waktu lama menitan sudah terkirim pelayanannya cepet pula dan yg pasti banyak opsi produk banyak jadi kita gak perlu bingun kalau pengen belanja terimakasih astro,1
424,Farah Hamidah,5,tadinya bingung mau beli bahan kebutuhan dimana tapi akhirnya tau astro groceries ini sangat mempermudah pembelanjaan kebutuhan makanan dan minuman gak perlu khawatir karna pilihan produknya banyak dan lengkap bangett jangan ragu buat coba aplikasi ini ya karna banyak benefitnya,1
425,Kalven efendi Kaur,5,aplikasi yang paling cepat dalam pengiriman saya di jakarta pesanan dari proses sampai di kirim cuma menit ini kalo saya bilang super cepat sih udah gitu produknya lengkap lagi jadi makin suka dengan astro,1
426,deiabcde,5,aplikasi ini mempermudah perbelanjaan kebutuhan makanan dan minuman pelayanannya juga cepet pengiriman barang jg hanya menit langsung nyampe keren bgt pokoknya nih aplikasi harga produk jg lumayan kompetitif,1
427,Aditya123 Jemblong,5,cocok nih buat prepare bakar di tahun baru nanti soalnya ada aneka sosis dan daging juga sayuran juga ada jadi waktu nya kumpul sama keluarga aj pilihan produknya lengkap dan banyak ya aneka merk nya,1
428,Rzl Gaming,5,wort it banget sih astro belanja jadi asik karena produk banyak dan lengkap banget kategori belanja juga sangat lengkap jadi malas belanja di e commerce lain di astro aja dah,1
429,Annisa Shofwil Mila,5,aplikasi yg rekomend banget buat yg mager keluar buat blanja kyak aku tinggal scroll pilih kebutuhan makanan minuman yg di butuhin sm prose pengirimannya jg cepet menurutku makanan sm minuman yg ada jg lengkap banget,1
430,Mimi 56,5,ga sia download apk astro ini pilihan produknya banyak dan lengkap bgt ga cuma itu pengiriman super cepat hanya menit barang sampai pembayarannya pun juga mudah bagi yg belum coba ayo download,1
431,Rikko Saputra,5,baru beberapa kali di coba ternyata astro keren banget mempermudah pembelanjaan kebutuhan makanan minuman ketika lagi males keluar rumah proses pengiriman cepat secepat kilat ga butuh waktu lama terima kasih astro,1
432,Depri Yanto,5,woww orderan yang kedua kalinya dan aku tetep heran karena sampainya cepat sekali dan again setelah sampai kondisi barang yg ku beli aman packingnya rapih dan oke bgt jadi dibawa kurirnya enak good job astro mempermudah pengguna dan kurir bintang dlu,1
433,Melianny Sitohang,2,kayaknya sdm untuk astrocare mesti ditingkatkan saya komplain berarti ada masalah yg perlu diselesaikan atau dijelaskan dg bnr aplikasi ini sudah bagus loh saya ikut dari awal namun komplainan saya gk pernah teratasi dg bner salah kirim ke rumah oranglah saya harus ambil sendiri kerumah org tsb iming gratis ongkir krn telat pengiriman padahal sengaja belanja bnyk biar gratis ongkir tanpa kompensasi apa saya tanya mslh harga yg gk sesuai jawaban astrocare gk nyambung dan ditutup gt aj,0
434,ALDI GUNAWAN,5,sangat istimewa sekali astro bayangin pengiriman belanjaan cuma menit doang ini keren sih menurut aku mana pilihan produknya lengkap dan banyak lagi waw makin mantep nih astro,1
435,Widya Septiani,5,kereen puas bgt belanja di astro ternyata pilihan produknya banyak bangeet mana pengirimannya juga cepet cuma menitan aja kondisi barang pas nyampe juga bagus suka banget dehh,1
436,Adhitya Yudha,5,aplikasi hebat karena mempermudah pembelanjaan kebutuhan makanan dan minuman pelayanan yang cepat pembayaran dengan proses yang mudah kondisi barang sangat baik harganya juga terjangkau dan yang paling penting pengiriman menit super cepat terima kasih astro,1
437,Rya Fitriana,5,baru kali ini nemu toko yg jualan paling lengkap cocok buat kamu yang males ke minimarket cari makan harga juga cukup kompetitif pengiriman juga cepet dan bayarnya jg bisa pake apa aja ngga nyesel deh kalo udh download astro,1
438,Calon Arang,5,enak banget pakai astro jadi lebih gampang dan praktis kalo mau belanja keperluan kebutuhan dirumah nih semua lengkp dan trsdia pengeriman pun cepat gapake lama,1
439,Septiana,5,mantep aplikasinya bisa mempermudah belanja makanan sama minuman terus pelayanannya cepet pembayarannya juga mudah bngt gak ribet apalagi pengirimannya super duper cepet bngt tepat waktu menit doang udah sampe pokonya gak nyesel deh pake aplikasi astro ini,1
440,Heynr,5,bagus banget aplikasinya cari apa aja yang di butuhin ada semua harganya murah kualitas barang mantap exp masih lama lebih gilanya lagi dari habis pembayaran terus ke proses sama ke pengiriman cuma menit pakai kode asthzn biar dapetin diskon k,1
441,Eliz Betcy,5,cus ga rugi deh download astro ga perlu repot keluar belanja tinggal tekan pilihan produk banyak lengkap banget pengiriman menit super cepat dah sampe rumah mantul deh pokoknya,1
442,Ref Indodana 156VAHYK diacc cpt bgt,5,tempat belanja online untuk kebutuhan harian dan groceries stok sebulan atau untuk dijual lagi mudah dan cepat serta banyak potongan diskon gunakan juga sobifc seperti yg ada diatas ulasan saya dapat beberapa diskon belanja rb astro baik sekali belanjaan saya diantarkan langsung kerumah terima kasih astro,1
443,Eko Perdana,5,aplikasi yang mempermudah pembelanjaan kebutuhan makanan dan minuman sangat praktis untuk orang yang sedang malas keluar rumah tapi ingin beli kebutuhan dapur harganya juga sangat terjangkau dan juga ada gratis ongkir setiap belanja,1
444,Brigita Yunita,5,it was a good experience awalan tau app astro agak sedikit skeptis kayak masa sih secepet itu udh pernah coba beberapa kali beli groceries lewat app lain tuh bisa sampe setengah jam baru dikirim padahal jaraknya deket juga pas akhirnya mutusin nyoba astro beneran dong cepet bgt nyampenya you guys please try this app and for astro thankyou for making my life more easier keep up the good work,1
445,Tridanti Antarini,5,bagus membantu anak kos dalam mempermudah mencari kebutuhan kos daging sayur buahnya lengkap susu cereal pun ada dan ga perlu lagi jalan kaki ke supermarket bisa dikirim proses pengiriman super cepat hanya menit saja,1
446,hilma sryn,5,aplikasi yang memberikan kemudahan bagi penggunanya sangat membantu dalam kegiatan sehari hari pilihan produknya banyak dan lengkap banget begitu juga dengan harga produknya lumayan kompetitif recommended banget nih aplikasi,1
447,Naura Bajri,5,aku ngga nyesel sih dengerin temenku buat download apk ini karna ternyata emang bener pilihan produknya banyak dan lengkap harga produknya juga kompetitif udh gtu pengirimannya cuma menit lagii luvv banget pokoknya sama apk inii,1
448,Dfauziah 13,5,belanja dalam hitungan menit kamu bisa belanja di aplikasi ini cuman dalam waktu menit pengiriman pilihan produk nya juga banyak dan lengkap banget dan satu lagi harga nya cukup terjangkau jadii buruan download yah,1
449,Andrian prandika,5,yang aku suka sih tampilan ny baguss sekali simple juga jadi enak buat pilih bahan yang mau dibeli apa lgi disini udah sperti mini market semua keperluan kebuthn buat makanan lengkap tinggl klik beli bayar langsung dikirim cukup mnit dah smpe nih,1
450,Listiana,5,aplikasinya bagus seneng banget bisa belanja disini karna pilihan produk banyak dan lengkap banget praktis bisa dianter sampai rumah trus juga proses pengiriman cepat,1
451,Annisa Setyowati,5,layanan yang diberikan sangat baik proses pengiriman setelah kita order sangat cepat pernah mesen jam malem ternyata tetep dianterin sama driver kurirnya produk yang diberikan selalu dalam kondisi baik pengemasannya sangat aman karna menggunakan kardus,1
452,Cici Ale,5,pokoknya super recommended pilihan produk banyak dan lengkap banget bener memanjakan mata kita belanja mau lebih praktis astro solusinya ayo download,1
453,Imam Fauzi,5,oke kios sudah jadi kepercayaan keluarga saya sejak dulu untuk belanja kebutuhan makanan dan minuman harga di sini lebih kompetitif ya lebih murahlah di banding e commerce lain terus pengiriman belanjaan juga super cepat banget ya hanya menit saja jadi ya astro menjadi aplikasi favorit saya dan keluarga,1
454,Anggiliani Slinah,2,lebih baik adain sistem cod deh atau ga saldo yang direfund balik ke akun pembayarannya jangan masuk ke saldo astro buat narik aja prosesnya lama banget x jam ini saya udh jam nungguin saya mau masak jadi susah karena dana saya tidak langsung kembali setelah minta pengajuan tarik dana,0
455,APRIL OFFICIAL,5,selama ini sih selalu menyenangkan pakai astro selain aplikasi nya yg menawarkan kecepatan dan ketepatan pengantaran astro juga memiliki banyak voucher untuk belanja yang bikin happy,1
456,Yuli Anty,5,pakai astro buat belanja secara online pas banget apa lagi produk di astro berkualitas dan harga murah untuk pembayaran mudah pengiriman cepat sekali ga nyesel poko nya klo pakai astro,1
457,Cyndi Yudha,5,belanja makanan dan minuman sekarang jadi mudah satu aplikasi tp pelayanannya cepat dan kirimnya cuma menit udah gitu nyampenya aman dan kondisi nya baik,1
458,Iyan fs,5,wahh kmren baru nyoba beli bahan makanan buat seminggu ternyata worth it bakal jadi apk andalan aku banget gaperlu keluar rumah tinggal pesan aja di astro soalnya pengiriman barang pesanan saya cepat hanya menit sudah sampai keren lah,1
459,Lina Sahabi,5,pengirimannya cuma butuh menit cuyy gue salut banget dah gtu kategori kebutuhan belanjanya banyakk kondisi barang nya juga baik semua apalagi harganya lumayan kompetitif,1
460,achker fz,5,saya dapet recommendasi dari temen asli ini aplikasi ngebantu banget buat yang ingin mengirim sesuatu aplikasinya bagus pengiriman nya juga cepat cocok banget buat zaman sekarang yang serba online,1
461,Jjkkth_ 75,5,asli yaa pake astro ini belanja jadi saset menit pengirimannya udah sampai terus ya pilihn produk banyak dan lengkap banget mempermudah banget buat berbelanja apalagi buat kaum sibuk macam saya gabisa kemana mana,1
462,Irwan Andriono,5,lagi males banget keluar rumah tapi gue butuh bahan buat masakan yuup gak perlu pusing lagi pakai astro banyak pilihan kategori kebutuhan belanja yang sangat lengkap udah gitu pengiriman cuma menit aja top banget deh,1
463,Muhammad sahril,5,angin segar bagi para wanita nih yg tidak trllu suka belanja kluar rumh cukup pakai astro aj lbih mudah dan hemat waktu karena saya akui di astro ini pengirimannya cepat entah kurirnya ngebut atau memang prsiapan baranf belanjaan cepat tapi sampai saat ini pesnan selalu diantar dengan tepat waktu,1
464,izull zul,5,sudah lama belanja pake astro dan masih setia sampai sekarang karena emang harganya relatif lumayan murah ya pilihan produk juga banyak dan lengkap banget ya jadinya malas pindah tempat belanja,1
465,Asni Kim,5,baru beberapa kli pake aplikasi ini udah suka banget soalnya lengkap banget disini pengiriman nya juga super cepat cuman menit trus proses bayarnya pun juga mudah banget,1
466,Horas Sirait,5,pelayanan cepat di aplikasi astro kebutuhan belanjanya juga lengkap dan terjangkau ditambah pengiriman cepat dan datang dengan kondisi baik semuanya bikin tambah percaya pakai aplikasi ini,1
467,Via Bellia,5,astroo the best sih untuk belanja kebutuhan makanan dan minuman pembayarannya cukup mudah sekali dan harga sangat murah serta produk juga berkualitas pengiriman nya juga terbilang cepat nih,1
468,Ellesia Sera,5,sejak pandemi selalu parno buat keluar rumah tapi selalu ada kebutuhan yang perlu di beli tapi sekarang lebih tenang karena ada aplikasi astro ini segala kebutuhan yang perlu dibelanjakan dapat dengan mudah dan cepat proses pengiriman serta kualitas barang yang didapatkan baik dengan harga yang lumayan terjangkau,1
469,Ricky Ars,5,waw astro e commerce yg top bgt bayangin pengiriman belanjaan cuma menit ini amazing banget sih super cepat kalo saya bilangnya layak dapat bintang sih tingkatkan,1
470,Nindi Kurnia,5,aplikasi ini memudahkan banget buat belanja pengiriman cepat proses pemabayarannya gampang fiturnya mudah dipahami kerenn,1
471,Depon,5,keren sekali apk nya semua keperluan yang aku butuhin untuk stok makanan kedepan ny semua ad lengkap produk juga kualitas bagus semua ga salah pilih apk sih ini kalo mau belanja jadi ga perlu keluar rumah,1
472,Aryantie Defrie,5,suka aplikasinya memudahkan belanja gak susah lagi mau keluar rumah proses pengiriman cepat pelayanan cepat pilihan produk banyak dan lengkap rekomend deh buat kaum mageran keluar rumah,1
473,kepall alfarizi,5,langganan astro dri awal launching ga pernah sma sekali kecewa belanja di astro kualitas barangnya oke barang di kemas dengan rapih proses kirim barangnya juga cepatt ngebantu bgt buat belanja,1
474,Geofanny Mozataufika,5,menurutku apk ini udh bagus banget sih karna memudahkan tugasku untuk belanja buat stok makanan di rumah mana proses pengirimannya cepet juga jadi gausah repot bawa barang banyak nntinya pokoknya rekomen bgt,1
475,N. Sari Amiyati,5,kecepatan pengirimannya super cepat hanya menit pilihan produknya disini paling banyak dan lengkap serta harganya kompetitif oke pokoknya,1
476,Kcong Sodron,5,tiap beli bahan masak di astro alhamdulillah tdk pernah mengecewakan barang yg dikirim kondisinya baik masih segar dan kualitasnya bagus terlebih lagi proses pengiriman barangnya cepat,1
477,niseu,5,sesuai namanya pengiriman sekitar menit super cepat kalo urgent butuh sesuatu tinggal belanja disini karena pilihan produk banyak dan lengkap banget oke banget pokonya,1
478,Fitria Rahmadini,5,proses pengiriman cepat cuma menit udah nyampe rumah awalnya bingung kenapa bisa cepat banget takut ada yang kurang apa gitu eh ternyata lengkap semua pesanannya dan good quality barang barangnya,1
479,Ferly Wahyu,5,selama masa pendemi ini saya menjadi lebih was jika belanja bulanan diluar karna takut akan virus tapi semenjak saya tau ada aplikasi astro saya jadi tidak was lagi karna belanja bulanan saya bisa melalui online dan ini jujur sangat mempermudah saya,1
480,Lutfi TM,5,astro emang ngga ada obat si baru checkout beberapa menit barang langsung diproses dan dikirim terus ngga sampe menit barang udah sampe di depan rumah proses pembayaran juga mudah dan soal harga bisa diadu sama toko lain,1
481,Vior Aspi,5,rekomen bangett pelayanan cepat proses pengiriman juga cepat cuman menit aja proses pembayaran juga mudahh yang paling oke tuh kondisi barangnya baik semuaa pokoknya love banget,1
482,Anisa Fratiwi,5,saya pakai astro dari jaman covid tahun kmren bner membantu saya sih dalam pembelian makanan dan minuman untuk dirumah dan waktu kirim barangnya juga cepat sekali semoga pengguna lama dikasih promo atau diskon lebih sering,1
483,asw tuko,5,pas banget kebutuhan dapur dan makanan dirumah habis ada diskon promo kalau bayar pakai kartu kredit mandiri lumayan bgt si itu apalagi di astro ini kategori kebutuhan belanjanya sangat lengkap mending beli di astro dripda ke supermarket,1
484,Fauziatul Azizah,5,aplikasi astro membantu banget untuk mempermudah belanja kebutuhan makanan dan minuman kategorinya juga sangat lengkap udah gitu pengirimannya cepat cuma menit dengan kondisi barang yang baik puass,1
485,pank junior,5,astro andalan aku ketika males keluar rumah buat belanja gimana tidak proses pengiriman barangnya cepat dan tak lupa sering banyak promo dan kalau order minimal rb bisa dapat gratis ongkir cakep bunda,1
486,Suparti S,5,kasih bintang deh udah nyoba beli belanjaan disini proses pengirimannya cepat menit sudah datang pesanan saya tingkatkan teruss astroo semangat buat para kurirnya juga yang ramah dan sering ya adain potongan harga apalagi tanggal tua,1
487,Ana Khaulah,5,semenjak pakai aplikasi ini saya semakin mudah berbelanja aplikasi astro menyediakan kategori kebutuhan belanja sangat lengkap seneng banget pokok nya good job buat aplikasi nyaa,1
488,Nisrin Humairoh,5,sudah x mencoba astro tidak pernah mengecewakan pengiriman pesanan saya bner cepat dan apabila ada yg tdk sesuai bisa di lalukan return sesuai s k yg berlaku keren lah sesuai jargon mereka belanja menit sampai,1
489,Medeia Belliard,5,kerenn bngett belanja make astro pengiriman menit super cepat rekomendasi banget sih buat yang ga sempet kepasar suka banget ama astro bakal langganan terus nih,1
490,Therecia,5,ga nyesel sama sekali pakai aplikasi ini pengiriman menit super cepat pilihan produk banyak dan lengkap fiturnya juga sangat mudah digunakan,1
491,fadil hadid,5,diaplikasi ini pilihan produknya banyak dan lengkap banget pokoknya nyari apapun semua bisa dibeli disini apalagi pengirimannya juga cepet banget ga nyesel download apk ini,1
492,Dinda Adila Surya,5,akhirnya nemu aplikasi astro pilihan produknya banyak banget lengkap gk susah lagi deh buat belanja pengiriman nya juga cepat cuma butuh waktu menit aa keren banget secepat itu pelayanannya,1
493,Karmen Manurung,5,woww keren banget aplikasinya aku suka banget ngak nyangka banget pokoknya lengkapdeh mulai dari kebutuhan sehari hari dan pengirimanya yang mudah dan nyaman banget dipakainya keren abiss deh pokoknya,1
494,Kirain Bella,5,aplikasinya sangat mempermudah saya dalam berbelanja karena pilihan produknya banyak dan lengkap banget selain itu pengiriman belanjaan saya hanya memakan waktu menit saja,1
495,Muhammad Zaky,5,yang suka belanja pasti suka kategori produk lengkap banyak lagi terus menit barang udah sampe super cepat banget pengirimannya harga produk juga kompetitif pelayanan cepat lagi,1
496,Queency Wonte,5,aplikasi nya memudahkan banget buat belanja kebutuhan sehari hari proses pengiriman belanjaan hanya menit belanja jdi gampang apalagi pilihan produk nya banyak dan lengkap banget,1
497,Mia Chia,5,sekarang gaperlu repot buat belanja ke luar rumah pake aplikasi ini sekali belanja online udah dapet apa yang dibutuhin soalnya produknya lengkap pelayanannya juga cepat tetap dipertahankan ya,1
498,Faiz,5,secara keseluruhan apk astro ini bagus nempermudah pembelanjaan kebutuhan makanan dan minuman dan packing nya pun bagus aman bagi driver saat membawanya jadi sampai tujuan itu kondisinya bagus suka si cepat juga datangnya,1
499,Fadli Yani,5,aplikasi ini memudahkan banget untuk belanja kebutuhan sehari hari pilihan produk banyak dan lengkap banget proses pembayaran mudah bener kebantu banget aplikasi ini tuu bermanfaat banget aplikasi astro,1
500,Zaidan Fahman,5,awalnya gak percaya aja ada layanan yang supercepat soal pengiriman tapi sejak menggunakan astro keraguan saya musnah bayangkan saja pengiriman belanjaan hanya menit,1
501,Anyaaa,5,pertama kali belanja lewat aplikasi ini ternyata melebihi ekspetasi saya karena pilihan produk banyak dan lengkap banget dan yang paling penting pengiriman belanjaan hanya menit saya sangat merekomendasi aplikasi ini,1
502,Ayotz Wae,5,rekomendasi banget nih gaes aplikasi belanja yg satu ini pilihan produk banyak dan lengkap banget harga produk lumayan kompetitit pelayanan cepat dan proses pengirman cepat menit nyampe serta untuk transaksi mudah mantap,1
503,Rbbywdynto,5,aplikasi ini benar membantu banget belanja jadi nggak perlu ribet lagi harganya lumayan kompetitif dan banyak pilihan barang yg kita butuhkan kalian yang belum download wajib download aplikasi ini,1
504,Irene Maria,5,bingung saat harus belanja akhirnya ketemu aplikasi ini dan senang luar biasa karena pilihan produk banyak dan lengkap banget jadi solusi teratasi disaat waktu mepet untuk masak,1
