,userName,score,clean_review,label
301,Diva Mafaza,5,seneng banget pake aplikasi astro buat belanja kebutuhan sehari hari secara online kategori kebutuhan belanja sangat lengkap jadi mau beli apapun pasti ada di astro selain itu pengirimannya cepet banget menit sampe jadinya ga perlu nunggu lama jadinya ga badmood nunggu belanja jadi praktis dan barang dijamin ok bener puas banget terimakasih astro,1
302,Samsung Samsungku77,5,nyesel kenapa ga dari dulu pakai apk belanja kebutuhan online gini udah hemat waktu hemat bensin apalagi kalau belanja minimal ribu dapat freeong pilihan produknya pun banyak dan lengkap bgt bagi saya pas deh paket datang juga cepet,1
303,Davina Dina,5,aplikasi sangat memuaskan pengiriman sangat cepat tidak smpai menit kurir ramah semoga tetap mempertahankan kecepatan pengiriman yaa dan selalu meningkatkan pelayanan,1
304,admin b33,5,aplikasi yg ngebantu banget buat orang kantoran super sibuk kayak aku yg harus belanja harian pesan disini tuh cepet bgt menitan udah sampai meskipun cepet barang yang dateng semuanya dalam keadaan baik dan aman pokoknya puas sama pelayanannya keren,1
305,Zeus Zel,5,ketemu lagi sama aplikasi yang mempermudah pekerjaan aku buat beli makanan sama minuman buat kebutuhan bulanan atau mingguan pengiriman ok banget ga lama cuma sekitar menit udah sampe ini yang tercepat sih karna ga makan banyak waktu selama pengiriman dan yang penting kondisi barang juga tentunya baik semua luv banget,1
306,Devi Rosmayanti,3,tertulis menit sampai terlambat jam masih bisa dimaklumi tapi apabila sudah melakukan pembayaran dari siang tak kunjung juga diproses sampai malam itu sih nama nya lalai mohon maaf mungkin tidak semua hub seperti ini pelayanannya ini khusus untuk hub kosambi sepertinya bagian warehouse nya terlalu santai dalam menangani pesanan tolong diperbaiki untuk pelayanan nya karena justru yg membuat beda astro dengan online shop yg lain adalah di kecepatan pengiriman nya itu,0
307,Elianna Surbakti2,5,terimakasih astro dan tim senang bgt belanja skrg jadi cepat ga pake ribet mempermudah pembelanjaan kebutuhan makanan dan minuman selain itu proses pembayaran mudah juga,1
308,lusi eka sari,5,di aplikasi astro proses pembayarannya mudah terus proses pengiriman cepat pelayanan cepat juga di aplikasi ini waktu barangnya sampai ditujuan juga kondisi barang baik semua kalau masalah harga harganya terjangkau sekali,1
309,Euis Citra,5,saya puas belanja melalui astro selain pilihan produk yang banyak dan lengkap belanja di astro pengirimannya cepat hanya menit sampai depan rumah cocok banget buat kaum rebahan yang pengen bebelian tapi gamau panas an karna sejak mengenal astro memudahkan kaum rebahan seperti diriku belanja kebutuhan makanan dan minuman tinggal buka aplikasi scroll sesuai yang mau dibeli bayar bdw proses pembayarannya mudah loh tunggu menit langsung sampai depan rumah terimakasih astr,1
310,Nabila Cinta,5,seneng banget astro layanannya sampai jam keren banget soalnya kadang butuh suatu barang tengah malam tapi ga berani keluar udh gitu proses pengiriman cepat ga perlu nunggu lama kondisi barang baik semua top banget dehh,1
311,ima wardanik,5,beruntung banget download apk ini soalnya semua kategori kebutuhan belanja yang ada diaplikasi ini lengkap banget jadi mau cari barang apapun semuanya ada disini dan pastinya belanja jadi lebih mudah,1
312,Boy Takasoni,5,grocery shop lebih mudah secara online pake astro ini proses pengiriman cepat pengiriman belanjaan hanya menit astro juga bisa jam jd gausah repot keluar rumah kalo ada perlu kebutuhan mendadak,1
313,Annisa,5,suka banget belanja di astro pengirimannya cepet banget menitan udah nyampe pilihan produknya juga sangat lengkap pembayaran mudah pokoknya recommended banget deh belanja di astro cocok buat kaum mageran kaya aku,1
314,Fanda Tya,5,mantap pengiriman cepat pilihan produk banyak dan lengkap harga lumayan bersaing banyak diskon pula pembayaran juga mudah banyak akses nya top,1
315,Siom Pur,5,helpful banget app astro ini memudahkan buat aku yang mageran ini aplikasinya juga mudah diakses pilihan produk banyak dan lengkap banget pelayanan dan pengiriman juga cepat superr dehh,1
316,hardi feb,5,akhirnya nemu aplikasi yg bikin belanja gak ribet pengirimannya cepet cuma menitan udah nyampek pas udah sampek kondisi barang yang dikirim juga aman dan baik gak ada yg rusak bayarnya juga flexibel bisa pilih pakai emoney transfer dll lengkap deh rekomen bgt buat yg mager kayak aku,1
317,Sonoci,5,pilihan produk banyak dan lengkap banget lengkap sama deskripsi cara penyajiannya jdi mudah klo cari bumbu yg cocok buat masakan aku ditambah astro bisa diantar lebih pagi gk panik lagi klo masak pagi kurang bumbu bisa pesen di astro langsung diantar,1
318,Aufa Rahmah Fauzan,5,apk ya bagus bangeett pilihan produknya lengkap dan banyak bangett harga produk juga lumayan kompetitif sama yg lain pengirimannya cuma butuh waktu menit ajaa dan super cepat dan proses pembayarannya mudah bangett suka bangett sama apk ini,1
319,Eben Manurung,5,astro benar keren abis lah apalagi dimasa pandemi ini sesuatu yang dikerjakan cepat dan tepat ada disini pengirimannya yang sangat membantu cuma menit aja tambahan produk yang super lengkap dan harga terjangkau benar sangat pas dan membantu makasih astro,1
320,018_ Ackil Maulana Marwan,5,kirain belanja hitungan menit tuh cuma selogan doang akhirya penasaran dan download nih aplikasi ternyata benar dong pengiriman menit super cepat ga cuma itu pilihan produk banyak dan lengkap banget dan yang paling penting harga produk lumayan kompetitif ini pastinya cocok banget buat gua dan kalian semua yang emang cari aplikasi yang cepat tapi dengan kualitas pelayanan dan barang yang bagus,1
321,Lonely,5,saya baru make astro tapi langsung syuka ya karena kecepatan pengirimannya emang benar sih pengiriman belanjaan cuma menit aja banyak pilihan produk dan lengkap pula duh jadi makin suka astro,1
322,Seftia Risyani,5,kaget banget tiba kurir udah di depan pintu rumah tok aja sat set banget pengiriman menit super cepat pokoknya harga produk juga lumayan kompetitif tapi astro lebih banyak plusnya buat emak rempong ini apk memudahkan banget belanja dari hape tanpa ribet tinggal tap cekout menit kemudian barangnya sampe keren bukan kuy install register mak nunggu apalagi,1
323,purnama suta,5,seneng banget belanja disini pengirimannya cepat cuma mnt udah pilihannya banyak lengkap harga juga terjangkau lho bisa utk yang mau mulai berbisnis online selain itu pelayanannya juga gampang proses tidak ribet dijamin nyaman shopingnya kalian,1
324,Listiani,5,suka banget deh sama pengiriman belanjaan di astro cepet banget gaperlu nunggu lama produknya juga banyak pilihannya mempermudah konsumen buat milih pokoknya harus coba sih belanja groceries di astro,1
325,Fahry Elsanjury,5,woww orderan yang kedua kalinya dan aku tetep heran karena sampainya cepat sekali dan again setelah sampai kondisi barang yg ku beli aman packingnya rapih dan oke bgt jadi dibawa kurirnya enak good job astro mempermudah pengguna dan kurir bintang dlu,1
326,Asep Ganteng,5,suka banget deh belanja di aplikasi astro sebab produknya banyak dan lengkap semua yg pasti ada di sini mau belanja makanan dan minuman semua jenis ada disini jadinya aku senang belanja disinj good kembangkan terus,1
327,KreditoKode { ZDMDX } pstiAcc,5,bagus banget aplikasinya cari ini cari itu ada harganya juga bersaing untuk pembayaran bisa melalui transfer atm dompet digital hanya belum mendukung fitur cod saja pengirimannya cepat langsung dikirim ke rumah kita atau sesuai dengan alamat yg kita masukan untuk pengiriman aplikasinya juga mudah digunakan dan gak bikin bingung,1
328,Muhammad rifki Arianto,5,astro aplikasinya bagus banget pengiriman barang nya cepet banget cuma menit saya akan merekomendasikan aplikasi astro ke temen saya di apk astro juga harga nya murah dan kompetitif produknya banyak dan lengkap astro memang beda dari aplikasi yang lain pokoknya mantul dehh,1
329,nunianrl,5,pertama kali pake apps dan lgsg kasi bintang karena emg sepuas itu gue thanks for understanding ur cust very well barang lumayan lengkap fitur oke dan fast bgt ui ux nya juga gampang ga ribet pro nya termia kasih fitur chat driver auto dibawa ke whatsapp jd cepet consnya masih banyak emg yg perlu diperhatiin status pemesanan selesai diapps tp barang blm sampe gabisa di confirm dgn gadanya tombol confirm pesanan gabisa lacak abangnya dimana dan fitur wa mlh abangnya chat mulu,1
330,Billa Sofia,5,trusted biarpun pakai diskon pas belanja barang yg dikirim kualitasnya bagus tanggal exp masih lama banget barang baru keluar dari pabrik bukan barang yg mendekati exp kayak aplikasi sebelah yg pasang harga murah taunya reject dan mendekati exp tapi kalau di astro harga mirip sama di agen dan barangnya pun gak bikin kecewa dan kapok terbaik,1
331,Diana Septiani,5,hallo saya baru menginstal apk astro ini menurut saya apk ini bagus apk ini telah mengelompokkan jenis produk nya jadi lebih memudahkan kita mencari kebutuhan yang kita inginkan dan harga produk lumayan kompetitif,1
332,Ana Luthfa,5,aplikasinya bagus barangnya lengkap tp saya kaget tiba dpt chat dr gosend karena ga kerasa pesen gosend jadi reflek bilang saya salah order trs pas klik btn chat yg kebuka wa lebih baik fitur chat ada di sisi apps astronya jangan buka apps lain challenge yaa semoga kedepannya semakin baik,1
333,R E N S GAMING,5,selalu nungguin promo mingguan di astro potongannya gila si bkin hemat dikantong lebih pilih belanja di sini karena simple barang belanjaan dikirimny cepat dan sampai dengan aman proses pembayarannya juga mudah sekali klik selesai,1
334,Anto Irawan,5,pengantaran barangnya cepat ga sampai menit sudah dapat wa dari driver kalau sudah ada di depan rumah pilihan kebutuhan belanja juga lengkap bagus saya suka belanja jadi lebih mudah tq,1
335,Zahrani Salsabila,5,aplikasi dengan fitur yg bermanfaat banget jadi bisa mempermudah kita untuk belanja kebutuhan makanan dan minuman untuk produknya juga banyak dan lengkap banget terus proses pengirimannya juga cepet bangett ga pake lamaa,1
336,Putri Syahrani,5,aplikasi sangat mempermudah pembelanjaan kebutuhan makanan dan minuman lengkap banget dari jajanan sampe bahan untuk masak engga perlu dateng ke tempat tinggal lewat aplikasi pilih barang yang mau dipesan recommended banget,1
337,Nurhikmah Febriani,5,dikarenakan aku kurang suka keramaian jadi aku nyaman dan cocok pakai apk belanja spt ini salah satu andalan aku ya astro ini karena proses pengiriman cepat butuh hanya menit dan pelayanannya bagus apalagi harganya jauh lebih murah disini dripda di apk lain banyak promo diskon di tanggal tua juga pengertian bgt,1
338,Di Jual,5,harga produk lumayan kompetitif di aplikasi astro ini banyak yang berpromo juga jadi lebih hemat kalau belanja di aplikasi astro pengirimannya cepat juga langsung sampai rumah dalam waktu singkat terima kasih astro,1
339,FERIANTO,5,mantap pilihan produk banyak dan lengkap jadi bisa milih sepuas nya gak cuma itu harga nya juga kompetitif jadi kita bisa lebih tau saat milih barang nya di tambah lagi pengiriman menit super cepat sekali deh pokoknya mantap sukses untuk astro,1
340,Budi Darma,5,di astro pengiriman belanjaan di jamin sampai cuma menit ini termasuk super cepat sih dibanding aplikasi belanja lain kita juga bisa berbelanja sesuai kategori karena kategori kebutuhan belanja di astro sangat lengkap dan produknya banyak jadi yuk belanja di astro,1
341,Amron Saidi,5,di aplikasi astro pilihan produk banyak dan lengkap banget ya mau apa aja ada dan murah banget pastinya harga produk lumayan kompetitif pokoknya lebih murahlah dari aplikasi belanja lainnya saya sih puas belanja di astro,1
342,Lala Lele,5,berguna banget aplikasinya buat aku yg suka masak pengirimannya sama pelayanannya cepet ga nunggu waktu lama udah gitu pilihan produknya banyak harganya juga oke ditambah banyak promo,1
343,Indir Firdana,5,puas banget belanja di astro pilihan barangnnya banyak dan harga produknya sangat kompetitif pengiriman belanjaan cepet baget cuma menit barang udah sampe pokoknya ga pernah nyesel belanja di astro,1
344,Uzwah Zahra,5,baru nyoba belanja pake aplikasi ini ternyata oke banget karna pengiriman belanjaan hanya menit dan juga pilihan produk banyak dan lengkap banget bakalan sering nih belanja di sini makasih astro,1
345,Anggie Yolanda,3,jujur agak kecewa sih sama astro biasanya saya order cepat dan selalu sesuai pesanan tetapi saya order pas di tanggal april pesanan saya mengalami keterlambatan hingga jam dan ketika saya menanyakan kepada cs astro baru pesanan saya dikirimkan kalau saya tidak wa ke cs astro sepertinya pesanan saya bakal dikirim sampai tengah malam atau sampai tidak ada orang yang menerima pesanan tersebut padahal awalnya mau kasih tips ke kurirnya dan reward ke astronya tetapi jadi mikir,0
346,Dewi Kurniati,5,terimakasih kasih berkat pakek astro aku anak kos sangat terbantu sekali gaperlu repot keluar rumah tanya pasar dimana atau beli alat keperluan kantor dimana tersedia sudah di astro ini pilihan produknya banyak dan lengkap dan banyak potongan harga juga kalau belanja banyak bis gratis ongkir,1
347,Citrah Amanda,5,bagus dapat memudahkan belanja di musim hujan seperti sekarang ini kebutuhan snack bahan dapur bahan pokok tersedia semua lengkap pkoknya pengriman pun cepat abang kurirnya juga ramah terimakasih approve bagi aku,1
348,Alpi Sunanda,5,wahh baguss banget aplikasinya cs responsif selalu mengutamakan kenyamanan saat transaksi kepada pelanggan proses pengiriman cepat hanya menit harga kompetitif bagus buat anak kos an thank astro,1
349,Fajar Adi Sofian,5,aplikasi ini dapat membantu kaum rebahan atau mageran yang malas buat keluar rumah pilihan produk nya banyak dan gratis ongkir untuk pengirimannya sangat banyak promo yg akan di peroleh jika sering belanja disini,1
350,Go Rio,5,aplikasi yang aku mau nih dimana lagi cari tempat belanja kebutuhan makanan dan minuman yang produknya banyak lengkap harganya juga kompetitif setelah barang datang cek kondisi semua bagus dan juga pelayanan yang cepat juga proses penngiriman belanjaan hanya butuh waktu manit aplikasi yang bisa diandalkan,1
351,Raihan Hadi,5,aplikasi astro ini membantu bgt di zaman serba online ini terutama aku yg suka belanja kebutuhan sehari yg cepat dan tdk perlu keluar rumah pengiriman yg hanya mnt sampai pilihan dengan total product dan yg penting astro tuh ready dan open keren bgt sih mantap astro pokonya,1
352,Aisyah Farhana,5,di aplikasi ini pilihan produk banyak dan lengkap bgt pelayan dan proses pembayaran jg mudah dan cepat pengiriman belanjaan jg cuma menit udah dateng dengan kondisi barang yang aman dan baik semua keren sih nih aplikasi,1
353,Muhammad makhmum awwaab,5,aplikasinya sederhana pengguna baru pasti bisa cara pesan nya menu pilihan produknya lengkap dan banyak dari segi harga yg saya cek disini cukup murah meriah,1
354,Lyra Gista,5,pokoknya ini best deal banget buat orang mageran kayak gue pilihan produk banyak dan lengkap banget apalagi harga barang nya pun terjangkau proses pengirimannya pun cepat ga butuh waktu lama,1
355,Devi Frida,5,bintang untuk kecepatan pengiriman nyampe nggak sampe menit perbaikannya perlu ditingkatkan variasi produknya supaya lebih lengkap dan tetap dipertahankan kecepatan akuratnya meskipun nanti lebih banyak pembelinya,1
356,Avrian Zulman,5,aplikasi yang recommended banget kenapa bisa begitu ini aplikasi pelayanan sangat bagus pengiriman nya juga super cepat hanya menit saja harganya sangat terjangkau kapan lagi bisa seenak itu dengan barang yang sangat berkualitas download sekarang jangan nyesel kalau ga download,1
357,Wede,5,selama pake aplikasi astro belanja apapun jadi ga ribet atau harus nunggu lama karena semenjak pake astro belanja jadi lebih mudah pengirimanpun jadi lebih cepat cuma menitan bisa langsung sampe ke rumah sebagus itu emang ini apk ga nyesel udah download,1
358,Erwin Magfiroh,5,sangat lengkap sekali produknya harganya cukup kompetitif dari apk yang lain fitur nya sangat mudah digunakan proses pengiriman cepat,1
359,AyyiL Munir,1,aplikasi aneh bin ajaib w belanja karena di iming i diskon kupon cashback eh pas w belanja sesuai syarat kupon entah kemana itu kupon gak ada pas udah dibayar dan barang sampe padahal jelas dan yakin w udh klik kuponnya alhasil gue gak dapet cashback komplain gak ada solusi aplikasi tuyul sorry it s not recommended mending belanja di warung kecil bener membantu umkm nyata drpd belanja online org kecil yg dibodohin,0
360,Iis Yudiyani,5,suka banget sama astro mau belanja online yang serba lengkap cuma ada disini udah lengkap harga kompetitif pengiriman cepat pula hanya dengan ± menit barang nyampe di tangan wow gak galau lagi deh walaupun dirumah aja semua kebutuhan terpenuhi karena ada astro terima kasih astro,1
361,Rizki Agrind,5,woww for the first time pake ini astro app mantap bgt sebenernya uda bbrp bulan lalu dikasi tau tmn tp baru cobain so far ini lagi coba order malem dong jam aqua galon refill dan beberapa item lainnya dan mantap sampe menit lah dengan package yg sangat proper pake box kardus ya even untuk beberapa item sedikit lebih mahal ya but its okay kardus no penyok overall good received smuanya keep doing best ur standar n promo free ongkir jalan terus ya,1
362,Nca Uyey,5,daripda pusing belanja di supermarket ujung nya boros ambil barang ini itu aku lebih suka kalau belanja bahan makan di astro sih selain harganya pas dikantong pelayanannya cepat dan bagus ada fitur yg sediain paket masakan gtu,1
363,Silvia setiawan,5,suka banget belanja disini kualitasnya best banget kalo bisa di perbanyak pilihan itemnya tambahkan item beras jagung terus pertahankan ya untuk harga sudah pas jangan di mahalin lagi,1
364,Sekar Novalia,5,mantep banget deh astro fitur apknya tuh simple dan mudah banget digunakan pilihan kategori kebutuhan belanjanya juga sangat lengkap apa aja ada deh di astro nih terus juga pelayanannya cepet banget deh sat set abizz jadi ngebuat para pembelinya tuh gak nunggu lama jadinya oh ya jangan lupain proses pembayaran nya juga sangat mudah dan cepat lho pokoknya luvv deh sama astro,1
365,Syafril,5,aplikasi astro memang paling bisa di andalkan mempermudah pembelanjaan kebutuhan makanan dan minuman selain itu pengiriman menit super cepat dan produknya juga banyak banget jadi ga perlu galau untuk milih milihnya deh,1
366,Azma D,5,belanja di astro pilihan produk banyak dan lengkap banget gak cuma sembako sama sayuran ada skincare sampe alat tulis juga saya pernah beli galon langsung diantar harga juga murah,1
367,TRF 4169 Sri Setya Meganingsih,5,pengiriman menit super cepat pilihan produk banyak dan lengkap banget harga produk hanya kompetitif mempermudah pembelanjaan kebutuhan makanan dan minuman kategori kebutuhan belanja sangat lengkap pelayanan cepat proses pengirman cepat proses pembayaran mudah kondisi barang baik semua harga terjangkau semakin baik pelayanan yang di berikan untuk pengguna,1
368,Nurlaela Sari,5,langganan astro dri awal launching ga pernah sma sekali kecewa belanja di astro kualitas barangnya oke barang di kemas dengan rapih proses kirim barangnya juga cepatt ngebantu bgt buat belanja,1
369,Damayanti Manis,5,puas banget belanja di sini pilihan produk nya variatif bagus yg saya suka pengiriman nya cepat hanya menit udah sampe bakal langganan trus belanja di sini,1
370,Yay,5,seperti biasa suka hunting aplikasi baru cari yang sepertinya bakal dibutuhkan salah satu apk baru yang bagus silahkan coba dulu aja buat cek lihat pilihan produk banyak dan lengkap banget dari segi harga produk lumayan kompetitif menurutku bermanfaat banget si siap sedia belanja dari rumah karna ada keterangan tanggal exp juga sayangnya blm sampe daerah aku tapi suka aplikasinya belanja ngga perlu takut ganggu kerja segera di kembangkan ke daerah jateng ya kak,1
371,Muhammad Fazrii,5,wehh belanja minimal rb dapat gratis ongkir pas bgt buat aku yang introved ini pengiriman barang belanjaan kita cepat butuh waktu ga sampai menit udh sampai di depan rumah alhamdulillah sekrang jadi lebih simple ga perlu keluar rumah panas an lagi thanksyou,1
372,ia wan,5,aku nemu aplikasinya lewat di sosmed trus iseng buat download eh ternyata produknya banyak dan super lengkap dong trus untuk filter yang mau kita belanja teratur dan gampang recomended sih soalnya aplikasinya memudahkan bgt,1
373,ruby jane,5,aplikasi ter keren sih ini rekomendasi buat kalian yang maunya super duper lengkap dan pecinta makan karena kategori kebutuhan belanja sangat lengkap dan apalagi satu hal ini keren yaitu mempermudah pembelanjaan kebutuhan makanan dan minuman gokil sih ini aplikasi,1
374,Klara Santiar,5,zaman milenial gini emang mempermudah belanja kebutuhan harian selain lengkap harganya juga kompetitif pelayanan cepat mantul banget,1
375,alping sinubu,5,dikarenakan aku kurang suka keramaian jadi aku nyaman dan cocok pakai apk belanja spt ini salah satu andalan aku ya astro ini karena proses pengiriman cepat butuh hanya menit dan pelayanannya bagus apalagi harganya jauh lebih murah disini dripda di apk lain banyak promo diskon di tanggal tua juga pengertian bgt,1
376,Yulianti,5,aplikasinya mudah digunakan ada banyak pilihan produknya dan juga lengkap selain itu untuk pembayaran juga mudah dilakukan cocok untuk kita yang nggak suka ribet suka deh rekomended pokoknya,1
377,azalea,5,seneng banget berkat aplikasi astro ini aku jadi ga bingung buat belanja lagi terus astro juga mempermudah pembelanjaan kebutuhan makanan dan minuman kategori kebutuhan belanja juga sangat lengkap pengiriman nya jangan diragukan lagi sangat cepat dan aman cuma menit dari aku pesan suda sampai dirumah pokoknya cocok banget buat yang mager belanja,1
378,S Y,5,pengalaman yang menyenangkan bisa belanja di astro aplikasinya smooth pengirimannya lumayan cepet pilihan pembayaran beragam dan pengemasan barangnya juga sangat rapih good job,1
379,Novia Oktavianti,5,suka banget sama apk ini pilihan produk banyak dan lengkap banget selain itu pengirimannya juga super cepet hanya menit pokoknya pelayanannya cepet banget deh kondisi barang nya juga baik semua yang lebih penting harganya mantepdeh,1
380,Sutiani Sutiani,5,bisa jadi alternatif buat yang gamau ribet ke pasar atau swalayan harganya lumayan kompetitif gak jauh beda dari harga pasaran dan pengirimannya juga cepat,1
381,Firman Febrian,5,baguss astroo kalau aku si suka pakai astro buat belanja kebutuhan dalam jumlah yg besar hrganya juga relatif sama dengan platform lain cuman di astro ini aku sukanya karena pilihan produknya banyak dan lengkap bgt jadi sekali cekout pasti banyak,1
382,Novi Syahputri,5,salah satu marketplace yg aku suka krn pengiriman yg sangat cepat cuma menit ajaa selain itu ada surprise harga yg lebih murah dari yg lain benar sangat ngebantu bgt krn disini toko jauuh suka banget jadinya belanja disini terimakasih ya semoga semakin suksess,1
383,Roy Stefanus,5,sejak saya makai aplikasi ini saya jadi mudah untuk membeli makanan dan snack yang saya mau dalam waktu cepat pengirimannya menit saja super cepat pelayanannya juga cepat dan bagus proses pembayarannya pun mudah barang yang dipesan juga sesuai dengan yang ada di aplikasi ini pokoknya the best lah astro ini,1
384,Dinda Istiqomah,5,belanja online yang enak dan bikin puas tuh ya karena pilihan produk nya beragam dan banyak terus proses pengiriman yang cepat jadinya kita gak nunggu lama nah di astro ini lengkap rekomen sih dari aku,1
385,Nurul Octaviani,5,pengiriman sangat cepat klaim nya menit sampai nyata nya tidak sampai menit paketnya sudah sampai mau pesan pagi atau malam sekalipun mantap tetap pertahankan yaa dan jgn lupa dibanyakin promo nya,1
386,lutfi anto,5,puas banget belanja di astro pilihan produk nya lengkap harga produk nya bisa diadu sama toko lain dan pastinya pembayaran nya mudah banget sama cepet sampe barangnya ngga nyesel pokoknya belanja di astro,1
387,Cendice Jenne,5,disini pilihan produk banyak dan lengkap banget kalian nggak perlu khawatir si mnurut gue karna dari segala makanan dan minuman sudah sangat lengkap mana pengiriman belanjaan hanya menit lagi cepett banget enggak perlu keluar rumah tinggal nunggu bbrp menit dah sampe cucok bangett,1
388,Mbadruz Zaman,5,saya sampaikan bahwa apk astro ini sangat bagus sekali untuk membantu mempermudah belanja kebutuhan rumah kualitas produknya juga terjaga sekali dan yang paling bkin takjub proses pengirimannya sangat cepat hanya menit,1
389,Parman Tarman,5,saya sampaikan bahwa apk astro ini sangat bagus dan membantu mempermudah belanja kebutuhan rumah kualitas produknya juga terjaga sekali dan yang paling bkin takjub proses pengirimannya sangat cepat just menit,1
390,Aldi,5,yg mau belanja nggak perlu cape lagi sekarang karena udah ada astro belanja kebutuhan makanan dan minuman jadi lebih gampang dan juga cepat karena astro berani kasih garansi menit belanjaan sudah sampai cobain aja deh,1
391,agustina linda,5,udah sering banget belanja di aplikasi ini dari mulai mie instan beras sabun dan masih banyak lagi karena emang pilihan produknya banyak dan lengkap banget harga produknya juga lumayan kompetitif kalo dibandingin dengan belanja di tempat lain recommended,1
392,Maryati Eti,5,sejak pandemi jadi agak worry keluar rumah apalagi harus belanja kebutuhan sehari haru dirumah terus aku nemuin aplikasi ini ternyata mempermudah pembelanjaan kebutuhan makanan dan minuman udah gitu harga produknya juga lumayan kompetitif jadi bisa dapet harga yang ga pricey seneng bgt,1
393,Mama Heni3891,5,pilihan produk banyak lengkap banget untuk harga cukup kompetitif pelayanannya pun cepat untuk proses pembayaran terbilang mudah mempermudah belanja banget deh pastinya,1
394,Yudha Pratama,5,baru aj coba untuk pesanan pertama puas sekali apa lagi baru pesen eh udh sampe aj kurng lebih menitan lah ternyata di astro ini cepat sekali untuk pengiriman nya terimksh untuk kurir yang sudah mengantarkan pesanan saya,1
