,userName,score,clean_review,label
200,Anggi Devtami,5,ini aplikasi nya manteepp dehh mana pilihan produknya banyak dan lengkap banget cocok nih buat yang mageran download aplikasi ini aja kalau mau lagi pengen cemilan udah gitu proses pengirimannya menit super cepat apalagi proses pembayarannya gampang bgt dan ketika sampai ke tangan kita kondisi barangnya baik semua gada yang penyok asli sihh ini keren beud aplikasi nya ngemudahin kita banget,1
201,Ferma Irrev,5,aplikasi andalan karena pilihan produk banyak dan lengkap banget jadi bisa belanja kebutuhan sekalian banyak terpenting si proses pengiriman cepat jadi tidak perlu khawatir puas belanja disini pokoknya deh,1
202,Aditya Cahaya,1,aplikasi apa an neh penawaran nya seh menggiurkan tp begitu di download dan mau belaja semua produk yg d klik sedang kosong semua udah gitu area tdk terjangkau kslo begitu buat apa di download unfaedah menuh hin memori aja uninstal lagi aja,0
203,Faiii,5,interface aplikasinya yang user friendly banget bisa dipake oleh siapa aja dari yang udah sering belanja online sampe yang baru pertama kali belanja online pilihan produknya juga lengkap dan variatif pula,1
204,sallary moon,5,pelayanan yang diberikan sejauh ini cukup memuaskan,1
205,al ichsan,5,ini aplikasi ya lumayan enak buat order makanan jenis makanannya lumayan lengkap dan murah tp byk kesediaan makanan diluar jangkauan area jd ada makanan yg gk bisa order but overall lumayan oke,1
206,Putri Indah,5,aplikasi ini jadi solusi bagi yang mau belanja kebutuhan online tanpa harus keluar rumah aplikasi ini memiliki banyak banget produknya seperti buah buahan oalahan susu dan telur bahan kue dan lain sebagainya tak hanya itu pengguna baru juga dapat diskon langsung hingga ribu untuk x transaksi pertama dan gratis ongkir,1
207,Rahmita Prasukam Dewi,5,suka banget sama astro aku kemarin belanja banyak banget cuma ribuan dapet promo telur isi butir juga terharu banget udah gitu sesuai banget sama klaimnya yg pengantaran menit sampai bener pengiriman menit super cepat gaboong mesti coba apk ini sih guys banyak promo menanti,1
208,Faqihah Raisya,5,bener mempermudah untuk belanja makanan dan minuman pilihan produknya banyak dan lengkap semua yang dibutuhin ada udah gitu pengirimannya cepet lagi menit doang udah nyampe wah gila si seneng banget,1
209,Fanesa Putri,5,kalau mau belanja anti capek ada astro cocok bgt tsayy proses pengirimannya cepat cuma menit sampai tinggal klik produk aja bayar selesai deh oh iya kalau belanja minimal rb bisa dapat gratis ongkir hemm cucok,1
210,Amel Tiara,5,aplikasi yang cocok banget untuk orang yang males keluar rumah untuk belanja karena pengiriman barang yang datengnya cepet banget harganya yang cukup relatif murah kategori yang sangat lengkap proses pembayaran nya pun cukup mudah dan yang paling terpenting disaat barang sampai semua dalam kondisi yang baik,1
211,Riana Sandri,5,alternatif pilihan aku ketika belanja banyak pakai astro karena ada gratis ongkirnya dengan minimal belanja dan kurirnya pun sampe dirumah dengan tepat waktu cepat proses pembayaran mudah bisa pakai ewallet atau mbanking good job astro,1
212,sayyidatina rahmah,5,walaupun pandemi sudah berakhir tapi masih worry untuk belanja keluar rumah astro ngebantu bangett selain kategori kebutuhan belanja sangat lengkap pengirimannya juga cepat terimakasih astro,1
213,Adi Setiyobudi,5,marketplace dengan desain yang elegan macam barangnya lengkap dengan harga yang bervariasi dari yang murah hingga mahal nilai plusnya pengiriman super cepat jadi gak perlu tunggu lama,1
214,Hana Lestari,5,aplikasi ini sangat membantu banget untuk aku yang ingin belanja makanan dan minuman proses pengirimannya sangat cepat udah gitu proses pembayarannya juga mudah barang yang sampai pun dalam kondisi baik dan segar semua,1
215,Zeani Ainun,5,aplikasi ini memudahkan banget buat aku yang suka males keluar rumah pilihan produk banyak dan lengkap banget jadi praktis juga klo kebutuhan lagi banyak proses pengirimannya juga cepat jadi ga perlu tunggu lama kereen,1
216,Siti Jumiati,5,aplikasi yang memudahkan untuk belanja kebutuhan sehari hari engga perlu repot datang ke tempat cukup lewat aplikasi ini bisa belanja kebutuhan pengiriman belanjaan menit super cepat sangat cocok buat para ibu yang punya anak masih kecil,1
217,Maulana Yusuf,5,aplikasi mudah digunakan tidak ribet dan komplit yang paling suka adalah pengiriman cepat sampai cuma menit mantap astro,1
218,ariel Sanjaya,5,puas belanja di astro ini pelayanan cepat dan proses pengiriman juga cepat soal pembayaran jangan kwatir proses pembayaran mudah dan banyak pilihan pembayaran di astro barang yang akan di kirim sudah di cek dan di pastikan kondisi barang baik semua,1
219,Fathiya Zahra,5,belanja di astro bener ngebantu banget pokoknya paket lengkap deh dengan waktu pengiriman cuma menit kan cepet bgtt ditambah lagi produknya lengkap dan pembayarannya mudah fiturnya juga bener gampang digunakan buat orang awam dan paling penting ada diskonnyaa top bgt astro,1
220,Win Ah,5,wahh bagus bkin mempermudah aku belanja kebutuhan rumah ya makanan minuman daging buah ada pelayanannya pun cepat dan bagus mantap sih terus kembangin apknya min kalau bisa tambahin di kampung saya dong di surabaya jadi kalau pulang kesana masih bisa pakai,1
221,Amelia Putri,5,aplikasi ini sangat cocok buat kaum mageran kaya saya bisa belanja dengan harga lebih murah dan pembayarannya sangat mudah aplikasi ini juga kadang banyak promo menarik nyakerenn deh belanja jadi lebih sat set sat set,1
222,Sri Yanti,5,sumpah kebantu bgt sama aplikasi ini uda ga perlu ribet tinggal scrol pilih oke beberapa menit pesanan nyampe pembayaran ga pake ribet semua produk ada lengkap pokonya sumpah keren semoga kedepannya semakin di update dan bisa menjadi lebih mudah dengan fitur baru lagii,1
223,Suka Ngakak,5,kerenn parahh produknya lumayan lengkap serta pengiriman yang fast banget sangat mudah jika ingin berbelanja kebutuhan pokok seperti makanan minuman pembayarannya juga gk ribet mudah banget the best deh aplikasinya,1
224,sea,5,cuma astro sih aplikasi belanja yang bisa kasih banyak promo seperti tebus murah dan diskon produk lainnya kelengkapan etalasenya juga keren banget semuanya tersedia dengan harga yg terjangkau pastinya,1
225,Anggun Nur Maulidya,4,sejauh ini performa sudah oke saran ya bagusnya di terapkan untuk astro sy jg tim devlop ktika pengiriman kalo bisa ada tracking kaya apsnya gojek delivery lainnya karna customer bisa siaga ktika brng sdh smpai mana biar ga tebak tebakan kurir sampe mana ya gitu ktika posisi driver udh tiba di alamat tujuan kalo bisa status baru berubah si driver sdh tiba di tujuan karna ada kendala ketika si delivery baru dkt atau detik mau deket status jadi driver sudah tiba pdhal blom sampe,1
226,Lilis Susanti,5,aplikasi belanja yang mudah digunakan dilengkapi dengan proses pembayaran yang mudah apalagi pengiriman belanja hanya menit sangat rekomend buat para ibu yang mau belanja tapi nggak ribet,1
227,RAHMAN Gg,5,mama saya suka dengan adanya aplikasi ini membantu dan memudahkan mama dalam urusan dapur fitur aplikasi ini lengkap serta adanya promo dalam aplikasi yang dapat menghemat biaya belanja pengiriman belanjaan super cepat serta proses pembayaran nya mudah dan juga tentunya banyak pilihan pembayaran semoga aplikasinya lebih bagus lagi dari yang sudah bagus,1
228,Agnes Giovanni,5,aplikasi yang praktis banget bagi penggunanya pengiriman belanjaan hanya menit super cepat kategori belanja juga sangat lengkap mempermudah bgt pokoknya mantepp deh,1
229,Ella Aprilia,5,mantep banget nih astro belanja disini pilihan produk banyak dan lengkap banget jadi buat kaum mager kaya aku aplikasi ini cocok banget sih selain pengirimannya yg cepat barang nya juga tertata rapi sesuai kategori asikk banget deh pokoknya,1
230,Thea Le,5,bagus cepet diantar harganya wort it,1
231,NiaKurnia dh,5,akhirnya ketemu aplikasi groceries dimana pilihan produk banyak dan lengkap banget bener ngebantu yang kadang kendala transportasi buat belanja tapi di app ini bisa langsung kebutuhan sehari di aplikasi thankyouu,1
232,Yeeloyme,5,sempat bingung beli barang yang di market terdekat nggak ada harus beli dimana ya habistu coba pake aplikasi astro ternyata beneran lengkap banget pilihannya banyak harganya juga terjangkau jadi makin hemat kalau belanja pakai astro,1
233,Fitri Manurung,5,aku suka banget sama aplikasinya pokoknya hebatlah dari segi berbagai barang yang lengkap semua kebutuhan aku ada disana cara bayarnya dan harganya pun terjangkau bangett dan tidak ketinggalan juga pengirimannya yang cepat pokoknya paslah sama aku the best,1
234,Rosyana Rahayu,5,mumpung sekarang lagi sering wfh sering banget belanja di astro karena kualitas barangnya yang bagus semua dan fresh pastinya pembayarannya juga mudah dan pengirimannya super cepat,1
235,Rumondang Tambunan,5,aku suka astro groceries ini karena untuk pengiriman belanjanya cuman menit belum lagi harga produknya yang kompetitif wah pokoknya membantu aku banget dalam belanja kebutuhan makan minum,1
236,Mugiwara _,5,aplikasi yg sangat membantu untuk seorang irt sekaligus pekerja karna pengiriman dan pelayanan cepat pembayarannya pun sangat mudah kategorinya lengkap dan barangnya segar sering ada promo aplikasinya nggak lelet atau lemot juga love poll pokoknya,1
237,Meike Marissa,5,bintang lima deh buat aplikasi astro belanja jadi lebih mudah udah gitu pengirimannya cepat dan banyak pilihannya juga bikin belanja nggak ribet tanpa harus keluar rumah aplikasi ini rekomen banget buat siihh,1
238,Sindy Alriyanti,5,sangat memudahkan dalam urusan belanja jadi ga perlu repot pergi ke pasar ga nyampe menit barang udah nyampe dianterin langsung ke depan rumah semua buah dan sayur yang dikirim selalu dalam keadaan segar juga ada estimasi expired date nya suka ada promo juga harga sangat bersaing sama harga pasar,1
239,Nurul Cahya Ningsih Syuria,5,sangat lengkap apapun yang dibutuhkan irt ada dari makanan sampai obatan skincare dll pun ada pelayanannya cepat dan proses pengirimannya cepat gk perlu nunggu wktu lama dan pilihan untuk pembayarannya banyak jadi gk pusing harus mikirin biaya admin krna beda bank,1
240,Rifka Sitohang,5,pertama kali mau download aplikasi astro gara rekomendasi dari temen katanya bagus banget pas aku cobain ternyata emg bener daftarnya juga gak ribet produknya juga lengkap pengiriman belanjaannya juga cuma menit doang jadi enak banget buat mempermudah pembelajaan kebutuhan makanan dan minuman buat konsumsi dirumah ku,1
241,Ridho Roma,5,sejak ada aplikasi ini kebiasaan yg sering belanja di luar jadi berganti jadi belanja dari rumah bener mempermudah hidup banget karena bisa lebih hemat tenaga dan waktu buat belanja,1
242,Rakes Allatif,5,aplikasi astro ini ngebantu banget buat kaum rebahan yang pingin belanja tapi males keluar karena di aplikasi ini tuh pilihan produknya banyak dan lengkap banget harga produknya pun lumayan kompetitif puas banget pokoknya belanja di aplikasi astro,1
243,Dwi Palembang,5,ini aplikasi bagus banget dan teroercaya bisa belanja sesuai dengan kebutuhan sehari hari kita dimana proses pembayaran mudah tidak ribet murah meriah dan pastinya pengiriman cepat no tunda ataupun ribet,1
244,Titiast 1918,5,pengiriman dan pelayanan nya cepet bgt keadaan balanjaan yg seger dan lengkap untuk pembayarannya mudah karna bisa pakai ewallet harganya juga masih kompetitif,1
245,Paulana Pau,1,app jelek amat ga bs cancel orderan alamat ga bs berubah sesuai titik lokasi apa fungsinya nyalain lokasi kalau ujung nya alamatnya yg tercantum dipesanan itu yg trakhir dipake cs nya pun di chat ga ad jawaban buat apa ada tombol chat dgn cs apus aj itu tombol ga guna,0
246,Sonia Fitri,5,aplikasinya mempermudah banget buat belanja pilihan produk banyak dan lengkap banget yang paling aku suka sih pelayanannya cepat sat set sat set ga perlu waktu lama barangnya langsung dikirim recommended banget buat yang harus belanja tapi males keluar rumah,1
247,palace palace,1,ketemu iklan di facebook yang harga barangnya ngiler setelah di instal mahal semua,0
248,Aku Anita,5,seneng bgt pake aplikasi astro berguna banget buat aku yg suka belanja online tapi yg sat set nyampe pengiriman cepat dalam hitungan menit udah gitu pelayanannya juga cepet barang yg dikirim juga dalam kondisi baik dan fresh semua lovee buat astro,1
249,Fitri R,5,selama pake ini aplikasinya bener membantu aku mempermudah pembelanjaan kebutuhan makanan dan minuman yang paling favorite dari aplikasi ini bisa dilihat dari pelayanannya apalagi pengiriman belanjaan hanya menit mantapp,1
250,Estren serly_rhma,5,solusi ketika tengah malem gaada makanan pasti selalu pesen lewat astro jam dan pasti bakal dilayanin dengan kurir nya yg ramah dan komunikatif banget untuk barang nya top quality dan segar semuanya mantap,1
251,Atika Fitriya Putri,5,mempermudah aku yang suka mager bisa belanja makanan dan minuman sepuasnya cuma minusnya tuh kadang aplikasinya logout sndri tp gpp lah yaa aku berharap next semoga bisa d upgrade lagi aplikasinya,1
252,Saling_Berbagi,5,sangat mantap aplikasi lain lewat coy soal kebutuhan numero uno soal pelayanan tak banyak bicara tp hasil gercep nb jgn hanya awal y bagusnya namun harus tetap seterusnya klo bisa dimaksimalkan semangat untuk tim astro indonesia,1
253,Atita Kukuh,5,aplikasi yg bener membantu pengiriman cepat dan banyak pilihan barang disini cs nya fast respon dan ramah ada gratis ongkir juga wah keren pokoknya,1
254,Kurnia Ramli,5,dengan aplikasi ini sangat mempermudah pembelanjaan kebutuhan makanan dan minuman khususnya bagi mereka yang punya mobilitas tinggi seperti aku sangat terbantu banget deh pokoknya thanks astro,1
255,primasty kusumawardhani,5,baru kali ini nemu aplikasi yg lengkap murah dan sat set bgt pengiriman belanjaan dalam hitungan menit jadi memudahkan kita untuk belanja dari rumah aja harga produknya lumayan kompetitif mantap bgt pokoknya suka deh ada aplikasi yg seperti ini,1
256,Ester Sumolang,5,suka banget dengan app ini pelayanannya cepat proses pengiriman cepat pembayarannya juga mudah fitur fiturnya mudah dipahami pas datang kondisi barangnya baik,1
257,Izdihar Nibras,5,pengiriman nya cepat cuma menit ga smpe menit barang nya lengkap semua ada disini semua harganya juga terjangkau dan juga pelayanannya sih no ramah bgt cepat jg dilayani nya,1
258,Kuy Kuykuy,5,aplikasi ini membantu bgtt sih pengiriman nya cepet poll cuma menit udah gitu pilihan produknya banyak dan lengkapp harganya terjangkau seneng banget belanja jd lebih cepat dan mudahh,1
259,Aulia Adin Ramadhani,5,fitur yang ditunjukkan mudah dipahami dan aplikasinya lancar apalagi pelayanan yang disajikannya cepat cocok untuk yang mau barangnya sampai dengan cepat dan aman,1
260,Tesya Febriani,5,sekarang gak pusing lagi nungguin belanjaan kapan datengnya belanja pake astro pelayanannya cepat banget pengirimannya cuma menit pilihan produknya banyak dan lengkap masalah harga di astro lebih miring sukses terus astro,1
261,Mergan Raya,5,proses pengiriman cepat bangett jadi enak kalau ada keperluan mendadak bisa langsung pesen ga perlu ribet nggak perlu bingung yang paling bagus kondisi barang baik dan segar semua,1
262,Via Febianti,5,super recommended banget buat yg mau coba belanja kebutuhan dari rumah pelayanannya jam bisa bayar dengan transfer e wallet dan pengirimannya sangat cepat harus coba belanja disini deh,1
263,Agung Meisandi,5,terimakasih kasih berkat pakek astro aku anak kos sangat terbantu sekali gaperlu repot keluar rumah tanya pasar dimana atau beli alat keperluan kantor dimana tersedia sudah di astro ini pilihan produknya banyak dan lengkap dan banyak potongan harga juga kalau belanja banyak bis gratis ongkir,1
264,yudi indra,5,ini aplikasi top banget deh banyak pilihan produknya n lengkap banget udah gitu harganya bersaing banyak diskonnya proses pengirimannya super cepat cuma hitungan beberapa menit rekommended deh pokoknya,1
265,Vivi,5,setelah mencoba menggunakan aplikasi ini ternyata aplikasi nya mudah bgt digunakan untuk pilihan produk juga banyak dan bervariasi dari segi harga produk terus kemudahan metode pembayaran serta pelayanan juga sudah bagus pengiriman juga super cepat dan packingnya juga termasuk aman karena barang datang juga masih dalam kondisi bagus,1
266,Ratih Wa,5,aplikasinya bagus sangat membantu sekali bagi aku yng anak kost apalagi anak kost yang mager buat keluar beli belanjaan kebutuhan pasti butuh banget aplikasi ini pilihan produk banyak dan lengkap banget sekali nyoba fitur nya ga ribet dan ga susah buat pemula gak nyesel install aplikasi astro,1
267,Ferra Rizky,5,penggunaan aplikasi sangat mudah menu tampilan tersusun rapi jadi nggak bingung kalau pertama belanja online selain itu banyak pilihan produknya dan super lengkap dari kebutuhan pokok elektronik makanan minuman kecantikan dan masih banyak lagi sekarang belanja semua kebutuhan sehari jadi lewat astro pengirimannya jangan ditanya x extra cepatt,1
268,Uswatun Hasanah,5,aplikasi yang super duper rekomendes buat kamu yang lagi cari kebutuhan pokok rumah tangga nihh pelayanan nya itu lohh cepet banget cara belanjanya juga gampang karna fitur nya mudah dipahami belanja kebutuhan super cepet deh pokoknya terakhir yang paling penting nihh disini banyak banget diskonnya,1
269,04_Almaziidah R.A,5,sangat recommended wajib download pengiriman super cepat dalam hitungan menit pilihannya produknya juga banyak anti ribet tinggal kli klik mantap,1
270,Noor Aina,5,dulu kalo belanja groceries suka nunggu lama tapi semenjak pake astro rasanya beda banget pelayanannya bener memuaskan apalagi dalam hal pengirimannya yg didukung kurir yang super cepat anter barangnya,1
271,tulippia 22,5,pengiriman secepat kilat bahkan cuma dalam hitungan menit barang langsung dikirim selain itu proses pembayaran ga ribet sama sekali dan banyak pilihan kategori kebutuhan yang sangat lengkap,1
272,Wemona Teresa Azalia,5,astro adalah solusi buat gue yang gak punya banyak waktu buat belanja semua bisa diakses di aplikasinya dan yang gak kalah penting harganya gak bikin kantong jebol belanja jadi praktis dan terjangkau,1
273,Novingka Djafar,5,puas sekali belanja di astro pilihan nya banyak sampai makanan kucing ad juga lengkap membantu sekali buat saya yang mager untuk keluar ini btw pengirimannya hitungan detik aja,1
274,Milkaッ,5,registrasi nya mudah aplikasi nya gampang di gunakan untuk keperluan belanja bahan makanan atau apapun semua lengkap disini harga bersaing untuk pengiriman cepat banyak produk pilihan yang sesuai dengan kebutuhan,1
275,Bramathias Luis Grandy,5,aslinya saya berfikir apa benar prosesnya cepat dan setelah saya menggunakannya ternyata benar saja pengiriman cepat banget menit saja dan barang aman harganya terjangkau beneran saya jadi ketagihan belanja disini barangnya lengkap banget terimakasih astro sering kasih promo ya,1
276,Hendriyana,5,abis coba pakai aplikasi ini untuk belanja eh ternyata bagus bangett dan kirimnya cepet buanget pembayaran nya juga banyak pilihannya banyak jadi seru sih belanja disini karna ga harus keluar rumah lagi,1
277,Park Inha,5,aplikasi belanja online terkeren sejauh ini valid no debat gimana engga keren produknya lengkap harganya juga pas di kantong dan udah gitu pelayanan sampe pembayarannya bagus dan memuaskan banget,1
278,Alya Amelia,5,sangat mempermudah pembelanjaan kebutuhan makanan dan minuman super lengkap banget apalagi pengirimannya yang cepat dalam hitungan detik aja intinya aplikasi membantu banget,1
279,Aprillia Lestari,5,pengiriman belanjanya hanya menit seneng banget dengan adanya aplikasi ini dari awal register sudah membantu sekali belanja enggak perlu nunggu lama datangnya banyak promo juga bertanggungjawab kualitas barang terjamin dan belanja dijam berapapun selalu ready dan responnya bagus pokoknya sangat membantu dalam kondisi mendesak jika ada sesuatu yang ingin dibeli,1
280,Andrean Syah,5,belanja di astro super cepat barang dikirimnya tak perlu pakai keluar rumah muter cari di rak minimarket lengkap juga pilihannya mulai dri snack biskuit vitamin makanan minuman sayur an pembayran di astro juga cukup mudah di lakukan dan cepat,1
281,nathania,5,aku tipe yang suka banget belanja apa di online karena lebih praktis dan menghemat waktu juga dan belanja lewat astro ini merupakan alternatif yg bagus disini pilihan produk nya banyak dan lengkap banget udah gitu pengiriman juga cepet ±cuma menit aja overall selama aku belanja disini sangat puas dengan pelayanannya jadi kalau kalian termasuk org yg mager buat keluar belanja atau beli makan bisa jadi kamu harus cobain apk astro ini dijamin ga akan kecewa,1
282,Haris Rismawan,5,saya pernah coba pesan melalui astro paket masak yang sapo tahu alhamdulillah murah dan banyak isi sayurnya pengiriman cepat packing oke cepat juga sampainya sesuai dengan keterangan menitnya saat kita pesan masak jadi lebih simple,1
283,Makhzumia,5,nemuin aplikasi yang memudahkan belanja gak perlu keluar rumah pengiriman cepat menit langsung sampe pelayanannya juga gercep dan gak lupa kesukaan kita harganya itu loh bisa bersaing dengan yg lain produknya juga bervariasi dan lengkap,1
284,Trecy Angelica,5,suka banget pake aplikasi ini yang paling bikin jatuh cinta tuh mempermudah pembelanjaan makanan dan minuman buat kaum mageran kayak aku di astro juga pelayanannya cepat proses pengiriman cepat dan proses pembayarannya mudah thank you astro,1
285,Maria Clarita Puspitasari,5,beberapa kali belanja online lewat astro selalu lancar udah gitu suka dpt promo potongan harga yg lumayan banget yang paling aku suka dari astro tuh pengiriman nya super cepat cuma menit keren kan terbaik pokoknya gabakal bosen deh belanja online di astro kategori kebutuhan belanja pun sangat lengkap di sini thanks astro,1
286,DwiRinaWati_S Kom S Pd Sum_Sel,5,ini aplikasi keren habis dimana kategori kebutuhan belanja sangat lengkap proses pembayaran mudah harga sesuai dompet alias murah pengirimannya pun cepat pokoknya engak diragukan lagi,1
287,cahyani ayu sulistyawati,5,wow dapet diskon untuk pengguna baru pengiriman belanja hanya menit super cepat sih kategori kebutuhannya pun cukup lengkap untuk pembayaran terbilang mudah,1
288,Muthoharoh Nur Alina,5,pelayanannya sangat cepat begitupun pengiriman belanjaan hanya menit harga produk lumayan kompetitif aplikasi ini juga dapat mempermudah pembelanjaan kebutuhan makanan dan minuman serta kategori kebutuhan belanja sangat lengkap sangat rekomended,1
289,Kirani Shandra,5,applikasi yang sangat membantu untuk memenuhi kebutuhan sehari hari jadi saya belanja gaperlu keluar rumah lagi cukup belanja pakai applikasi astro ini pengiriman belanjaan hanya menit juga pilihan produknya banyak dan lengkap banget pokonya sangat membantu dan mudah untuk di gunakan proses pembayaran mudah jadi tidak bikin ribet,1
290,Syahrul Irawan,5,gilee pertama kali belanja pakai aplikasi ini saya sangat shock dengan proses pengirimannya yang cepat sekali gimana gak shock baru beberapa menit pesan belanjaan saya sudah sampai di tangan pokoknya mantap banget dah ni aplikasi,1
291,Pamrihati I,5,rekomend banget ni aplikasi astro pilihan produk banyak dan lengkap harga produk lumayan murah proses cepat dan pembayaran pun mudah jadi gak susah lagi mau keluar rumah selagi ada aplikasi astro ini mempermudah pembelanjaan kebutuhan tiap bulannya,1
292,aristy novia Putri,5,aku tiap habis kebutuhan bulanan di rumah selalu pilih buat belanjanya pakai aplikasi astro aja keren banget loh pengiriman menit super cepat barang yang aku terima juga kondisinya baik semua suka banget deh pkoknya sama astro,1
293,Alfina Rahmawati,5,dengan adanya aplikasi ini bisa memudahkan bagi aku yang orangnya lumayan sibuk di aplikasi ini aku bisa bebas belanja segala jenis kebutuhan makan minum dan lainnya di mana saja dan kapan saja pengiriman yang digunakan juga cepet banget toko yang responsif dan produk yang berkualitas buat aku selalu puas belanja di sini,1
294,Y. Angel Eliezer Wijaya,5,aplikasi ini keren dan bermanfaat sekali •̀ᴗ di sini belanja bakal jadi jauh lebih mudah pengiriman belanjaan hanya menit wuahh cepat kan ≧≦ kualitas kondisi barang baik semua yuk instal aplikasi ini dan dapatkan manfaat lainnya ≧≦,1
295,renatha yullyvia irani,5,baru pertama kali order di astro langsung suka karena dapet diskon pengguna baru dan gratis ongkir semua barang yg kucari juga ada disini harga juga murmer proses pembayaran nya mudah dan cepat tidak ribet pengiriman barang juga tergolong cepat jadi bisa pesan bahan dengan kondisi fresh sih kalo gini bakal pakai astro terus,1
296,SEPTIANA MIKI,5,masuk salah satu aplikasi belanja yang paling bagus banyak pilihan dan super lengkap banget produknya pengiriman juga cepet dan yang paling penting pelayanannya cepet bagus banget aslii parah yg belum coba aplikasi astro saran aku mending coba sekarang sih,1
297,jelita purba,5,aplikasi astro merupakan aplikasi kategori kebutuhan sangat lengkap harga produk lumayan kompetitif pengirimannya menit super cepat pilihan produk banyak dan lengkap banget dan pelayanan cepat buruan download deh,1
298,Joya,5,kemarin coba pertama kali belanja pake astro ini dan ga expect bakal cpt banget sampenyaa pengiriman menit super cepet banget dehh pokoknya ini cocok banget sih kalo lagi males keluar terus butuh barang cepet bisa banget pake ini anti ribet dan anti lama,1
299,Indah Yogiq,5,harga yang ditawarkan astro sangat masuk akal tanpa promo dan diskon pun harganya sebelas duabelas dengan harga swalayan kalau pakai promo bahkan harga sayur bisa setara dengan pasar tradisional promonya astro nggak banyak syarat apalagi untuk pengguna baru ada promo gratis ongkir dan diskon harga barang jumlahnya juga lumayan,1
300,Viara Tia,5,galau pengen bgt belanja cepet pas lagi butuh iseng buka playstore liat apk astro langsung download donk kaget pas lihat ternyata pilihan produk banyak dan lengkap banget loh langsung jatuh cinta apalagi proses pengiriman cepet langsung satset eh barangnya dateng kondisi barangnya oke banget gamau lagi deh pindah apk,1
